{
  "schema_version": "0.3.0",
  "contract_kind": "objgauss.checkpoint_manifest",
  "identity": {
    "experiment_id": "pr02a-fixture-experiment",
    "trial_id": "trial-action-conditioned-config-a-seed-101",
    "checkpoint_id": "checkpoint-action-conditioned-config-a-seed-101",
    "model_arm": "action_conditioned",
    "training_seed": 101
  },
  "selection": {
    "split": "validation",
    "metric": "target-object-multistep-effect-vs-hold-objectstate-error",
    "validation_primary_error": 0.42,
    "epoch": 16,
    "optimizer_update": 800
  },
  "configuration": {
    "config_id": "config-a",
    "config_sha256": "2e7d2c03a9507ae265ecf5b5356885a53393a2029d241394997265a1a25aefc6",
    "architecture_sha256": "18ac3e7343f016890c510e93f935261169d9e3f565436f47b1c6bf10f2163e71",
    "parameter_count": 4096,
    "optimizer_state_included": false
  },
  "payload": {
    "uri": "generated/pr02c/checkpoints/checkpoint-action-conditioned-config-a-seed-101.safetensors",
    "media_type": "application/vnd.objgauss.pytorch-state-dict",
    "sha256": "2e7d2c03a9507ae265ecf5b5356885a53393a2029d241394997265a1a25aefc6",
    "byte_size": 1047552
  },
  "compatibility": {
    "python_version": "3.10.20",
    "torch_version": "2.13.0+cu130",
    "runtime_lock_sha256": "18ac3e7343f016890c510e93f935261169d9e3f565436f47b1c6bf10f2163e71",
    "device_kind": "cuda"
  },
  "final_evaluation_eligible": true,
  "provenance": {
    "source_commit": "91bc05e9f3648a44e7e8d161420a26d1c40a5d6f",
    "source_tree_sha256": "b493d48364afe44d11c0165cf470a4164d1e2609911ef998be868d46ade3de4e",
    "experiment_spec_sha256": "4f4a9410ffcdf895c4adb880659e9b5c0dd1f23a30790684340b3eaacb045398",
    "runtime_lock_sha256": "18ac3e7343f016890c510e93f935261169d9e3f565436f47b1c6bf10f2163e71"
  }
}
